{
  "schema_version": "v0",
  "check_result_id": "lean-check-release-pcs-v0.1-labtrust-qc",
  "release_id": "release-pcs-v0.1-labtrust-qc",
  "obligation_set_id": "obl-set-release-pcs-v0.1-labtrust-qc",
  "status": "ProofChecked",
  "lean_version": "leanprover/lean4:v4.24.0",
  "checked_at": "2026-05-22T00:54:57Z",
  "checker": "pcs-core",
  "checker_version": "0.1.0",
  "results": [
    {
      "obligation_id": "obl-certificate-matches-runtime",
      "lean_theorem": "PCS.CertificateMatchesRuntime",
      "status": "ProofChecked",
      "source_artifacts": [
        "trace_certificate.json",
        "runtime_receipt.json"
      ],
      "result": "passed",
      "checked_at": "2026-05-22T00:54:57Z",
      "lean_version": "leanprover/lean4:v4.24.0"
    },
    {
      "obligation_id": "obl-verification-admits-bundle",
      "lean_theorem": "PCS.VerificationAdmitsBundle",
      "status": "ProofChecked",
      "source_artifacts": [
        "verification_result.json",
        "science_claim_bundle.certified.json"
      ],
      "result": "passed",
      "checked_at": "2026-05-22T00:54:57Z",
      "lean_version": "leanprover/lean4:v4.24.0"
    },
    {
      "obligation_id": "obl-signed-bundle-admissible",
      "lean_theorem": "PCS.SignedBundleAdmissible",
      "status": "ProofChecked",
      "source_artifacts": [
        "signed_science_claim_bundle.json",
        "science_claim_bundle.certified.json"
      ],
      "result": "passed",
      "checked_at": "2026-05-22T00:54:57Z",
      "lean_version": "leanprover/lean4:v4.24.0"
    },
    {
      "obligation_id": "obl-rejected-certificate-not-admissible",
      "lean_theorem": "PCS.RejectedCertificateNotAdmissible",
      "status": "ProofChecked",
      "source_artifacts": [
        "trace_certificate.json"
      ],
      "result": "passed",
      "checked_at": "2026-05-22T00:54:57Z",
      "lean_version": "leanprover/lean4:v4.24.0"
    },
    {
      "obligation_id": "obl-stale-certificate-not-admissible",
      "lean_theorem": "PCS.StaleCertificateNotAdmissible",
      "status": "ProofChecked",
      "source_artifacts": [
        "trace_certificate.json"
      ],
      "result": "passed",
      "checked_at": "2026-05-22T00:54:57Z",
      "lean_version": "leanprover/lean4:v4.24.0"
    }
  ],
  "pf_explain": null,
  "source_repo": "https://github.com/SentinelOps-CI/pcs-core",
  "source_commit": "1a04707e6f6df43b6dddb8d593413c17796e9c39",
  "signature_or_digest": "sha256:b8c9bb8bf723899dead4ce19632943887525b54e4a80400cb00d5a568156384f"
}
